{"schemaVersion":"1.0.0","attestationType":"denominator-technical-review","authority":"independent-agent-review","status":"attested","decision":"approved","reviewer":"gpt-m0-denominator-v2-review","attestedAt":"2026-09-14T13:13:03Z","manifestVersion":"2.0.0-m0","scope":"denominator-technical-review","preAttestationBinding":{"kind":"pre-attestation-denominator-release/v2","manifestIndexSha256":"4e0c7ad81c8da5c56a994b61c79b9b619a5525971a2172dd0209026b66049684","sha256sumsSha256":"09071100156c3ef85f1e0a30f81d1c2ffb0d1e6d4273cde4370de32b0738915d"}}